{
  "$schema": "schema/piano-profile-v3.schema.json",
  "schema_version": 3,
  "id": "concert_grand_a",
  "display_name": "Concert Grand A",
  "midi_min": 21,
  "key_count": 88,
  "sympathetic_mode_count": 88,
  "variation_seed": 1128743217,
  "default_key": {
    "tuning_cents": 0.0,
    "inharmonicity_b": 0.000357735149,
    "loss_rate_per_second": 1.111152487,
    "loss_slope_per_second": 0.006756188051,
    "second_string_level": 1.0,
    "third_string_level": 1.0,
    "unison_width_cents": 0.308625,
    "hammer_gain": 1.0,
    "hammer_contact_min_seconds": 0.00022,
    "hammer_contact_range_seconds": 0.0037,
    "hammer_cutoff_base_hz": 872.381731,
    "hammer_cutoff_hardness_hz": 300.8694,
    "hammer_filter_mix": 0.58,
    "hammer_string_gain": 1.0,
    "felt_frequency_scale": 0.94,
    "felt_gain": 1.0,
    "damper_presence": 1.0,
    "damper_closed_t60_seconds": 0.0975,
    "damper_lift_start": 0.11307737194,
    "damper_lift_end": 0.79307737194,
    "sympathetic_open_t60_seconds": 3.241927644223,
    "sympathetic_second_level": 0.46,
    "sympathetic_third_level": 0.26125,
    "radiation_scale": 1.0,
    "sympathetic_scale": 1.0
  },
  "keys": {
    "21": {
      "tuning_cents": -2.86,
      "inharmonicity_b": 0.000243149911,
      "loss_rate_per_second": 0.081,
      "loss_slope_per_second": 0.000105992577,
      "second_string_level": 0.0,
      "third_string_level": 0.0,
      "unison_width_cents": 0.308625,
      "hammer_gain": 1.0,
      "hammer_contact_min_seconds": 0.00022,
      "hammer_contact_range_seconds": 0.0037,
      "hammer_cutoff_base_hz": 673.375,
      "hammer_cutoff_hardness_hz": 31.625,
      "hammer_filter_mix": 0.58,
      "hammer_string_gain": 1.0,
      "felt_frequency_scale": 0.94,
      "felt_gain": 1.0,
      "damper_presence": 1.0,
      "damper_closed_t60_seconds": 0.14,
      "damper_lift_start": 0.08,
      "damper_lift_end": 0.76,
      "sympathetic_open_t60_seconds": 4.778923619271,
      "sympathetic_second_level": 0.46,
      "sympathetic_third_level": 0.28,
      "radiation_scale": 1.0,
      "sympathetic_scale": 1.0
    },
    "22": {
      "tuning_cents": -2.86,
      "inharmonicity_b": 0.000234327297,
      "loss_rate_per_second": 0.08384821,
      "loss_slope_per_second": 0.000122379573,
      "second_string_level": 0.0,
      "third_string_level": 0.0,
      "unison_width_cents": 0.308625,
      "hammer_gain": 1.0,
      "hammer_contact_min_seconds": 0.00022,
      "hammer_contact_range_seconds": 0.0037,
      "hammer_cutoff_base_hz": 674.76495,
      "hammer_cutoff_hardness_hz": 33.50552,
      "hammer_filter_mix": 0.58,
      "hammer_string_gain": 1.0,
      "felt_frequency_scale": 0.94,
      "felt_gain": 1.0,
      "damper_presence": 1.0,
      "damper_closed_t60_seconds": 0.14,
      "damper_lift_start": 0.080033468974,
      "damper_lift_end": 0.760033468974,
      "sympathetic_open_t60_seconds": 4.753117369654,
      "sympathetic_second_level": 0.46,
      "sympathetic_third_level": 0.28,
      "radiation_scale": 1.0,
      "sympathetic_scale": 1.0
    },
    "23": {
      "tuning_cents": -2.86,
      "inharmonicity_b": 0.00022557921,
      "loss_rate_per_second": 0.086703505,
      "loss_slope_per_second": 0.000142604363,
      "second_string_level": 0.0,
      "third_string_level": 0.0,
      "unison_width_cents": 0.308625,
      "hammer_gain": 1.0,
      "hammer_contact_min_seconds": 0.00022,
      "hammer_contact_range_seconds": 0.0037,
      "hammer_cutoff_base_hz": 676.23755,
      "hammer_cutoff_hardness_hz": 35.497862,
      "hammer_filter_mix": 0.58,
      "hammer_string_gain": 1.0,
      "felt_frequency_scale": 0.94,
      "felt_gain": 1.0,
      "damper_presence": 1.0,
      "damper_closed_t60_seconds": 0.14,
      "damper_lift_start": 0.080132642018,
      "damper_lift_end": 0.760132642018,
      "sympathetic_open_t60_seconds": 4.726564850618,
      "sympathetic_second_level": 0.46,
      "sympathetic_third_level": 0.28,
      "radiation_scale": 1.0,
      "sympathetic_scale": 1.0
    },
    "24": {
      "tuning_cents": -2.86,
      "inharmonicity_b": 0.000217157713,
      "loss_rate_per_second": 0.089144628,
      "loss_slope_per_second": 0.000166201689,
      "second_string_level": 0.0,
      "third_string_level": 0.0,
      "unison_width_cents": 0.308625,
      "hammer_gain": 1.0,
      "hammer_contact_min_seconds": 0.00022,
      "hammer_contact_range_seconds": 0.0037,
      "hammer_cutoff_base_hz": 677.797716,
      "hammer_cutoff_hardness_hz": 37.608675,
      "hammer_filter_mix": 0.58,
      "hammer_string_gain": 1.0,
      "felt_frequency_scale": 0.94,
      "felt_gain": 1.0,
      "damper_presence": 1.0,
      "damper_closed_t60_seconds": 0.14,
      "damper_lift_start": 0.080295668313,
      "damper_lift_end": 0.760295668313,
      "sympathetic_open_t60_seconds": 4.699257182149,
      "sympathetic_second_level": 0.46,
      "sympathetic_third_level": 0.28,
      "radiation_scale": 1.0,
      "sympathetic_scale": 1.0
    },
    "25": {
      "tuning_cents": -2.86,
      "inharmonicity_b": 0.000209050613,
      "loss_rate_per_second": 0.091217629,
      "loss_slope_per_second": 0.000194405859,
      "second_string_level": 0.0,
      "third_string_level": 0.0,
      "unison_width_cents": 0.308625,
      "hammer_gain": 1.0,
      "hammer_contact_min_seconds": 0.00022,
      "hammer_contact_range_seconds": 0.0037,
      "hammer_cutoff_base_hz": 679.450655,
      "hammer_cutoff_hardness_hz": 39.845003,
      "hammer_filter_mix": 0.58,
      "hammer_string_gain": 1.0,
      "felt_frequency_scale": 0.94,
      "felt_gain": 1.0,
      "damper_presence": 1.0,
      "damper_closed_t60_seconds": 0.14,
      "damper_lift_start": 0.080520697039,
      "damper_lift_end": 0.760520697039,
      "sympathetic_open_t60_seconds": 4.67118631491,
      "sympathetic_second_level": 0.46,
      "sympathetic_third_level": 0.28,
      "radiation_scale": 1.0,
      "sympathetic_scale": 1.0
    },
    "26": {
      "tuning_cents": -2.86,
      "inharmonicity_b": 0.000201246175,
      "loss_rate_per_second": 0.092997997,
      "loss_slope_per_second": 0.000229196423,
      "second_string_level": 0.0,
      "third_string_level": 0.0,
      "unison_width_cents": 0.308625,
      "hammer_gain": 1.0,
      "hammer_contact_min_seconds": 0.00022,
      "hammer_contact_range_seconds": 0.0037,
      "hammer_cutoff_base_hz": 681.201882,
      "hammer_cutoff_hardness_hz": 42.21431,
      "hammer_filter_mix": 0.58,
      "hammer_string_gain": 1.0,
      "felt_frequency_scale": 0.94,
      "felt_gain": 1.0,
      "damper_presence": 1.0,
      "damper_closed_t60_seconds": 0.14,
      "damper_lift_start": 0.080805877378,
      "damper_lift_end": 0.760805877378,
      "sympathetic_open_t60_seconds": 4.642345099934,
      "sympathetic_second_level": 0.46,
      "sympathetic_third_level": 0.28,
      "radiation_scale": 1.0,
      "sympathetic_scale": 1.0
    },
    "27": {
      "tuning_cents": -2.86,
      "inharmonicity_b": 0.000193733098,
      "loss_rate_per_second": 0.094202917,
      "loss_slope_per_second": 0.000270403977,
      "second_string_level": 0.0,
      "third_string_level": 0.0,
      "unison_width_cents": 0.308625,
      "hammer_gain": 1.0,
      "hammer_contact_min_seconds": 0.00022,
      "hammer_contact_range_seconds": 0.0037,
      "hammer_cutoff_base_hz": 683.057242,
      "hammer_cutoff_hardness_hz": 44.724504,
      "hammer_filter_mix": 0.58,
      "hammer_string_gain": 1.0,
      "felt_frequency_scale": 0.94,
      "felt_gain": 1.0,
      "damper_presence": 1.0,
      "damper_closed_t60_seconds": 0.14,
      "damper_lift_start": 0.081149358511,
      "damper_lift_end": 0.761149358511,
      "sympathetic_open_t60_seconds": 4.612727359084,
      "sympathetic_second_level": 0.46,
      "sympathetic_third_level": 0.28,
      "radiation_scale": 1.0,
      "sympathetic_scale": 1.0
    },
    "28": {
      "tuning_cents": -2.86,
      "inharmonicity_b": 0.000186500504,
      "loss_rate_per_second": 0.094890243,
      "loss_slope_per_second": 0.000320590401,
      "second_string_level": 0.124259,
      "third_string_level": 0.0,
      "unison_width_cents": 0.308625,
      "hammer_gain": 1.0,
      "hammer_contact_min_seconds": 0.00022,
      "hammer_contact_range_seconds": 0.0037,
      "hammer_cutoff_base_hz": 685.022928,
      "hammer_cutoff_hardness_hz": 47.383961,
      "hammer_filter_mix": 0.58,
      "hammer_string_gain": 1.0,
      "felt_frequency_scale": 0.94,
      "felt_gain": 1.0,
      "damper_presence": 1.0,
      "damper_closed_t60_seconds": 0.14,
      "damper_lift_start": 0.08154928962,
      "damper_lift_end": 0.76154928962,
      "sympathetic_open_t60_seconds": 4.582327955899,
      "sympathetic_second_level": 0.46,
      "sympathetic_third_level": 0.28,
      "radiation_scale": 1.0,
      "sympathetic_scale": 1.0
    },
    "29": {
      "tuning_cents": -2.86,
      "inharmonicity_b": 0.000179537923,
      "loss_rate_per_second": 0.095152568,
      "loss_slope_per_second": 0.000384044054,
      "second_string_level": 0.448113,
      "third_string_level": 0.0,
      "unison_width_cents": 0.308625,
      "hammer_gain": 1.0,
      "hammer_contact_min_seconds": 0.00022,
      "hammer_contact_range_seconds": 0.0037,
      "hammer_cutoff_base_hz": 687.1055,
      "hammer_cutoff_hardness_hz": 50.201558,
      "hammer_filter_mix": 0.58,
      "hammer_string_gain": 1.0,
      "felt_frequency_scale": 0.94,
      "felt_gain": 1.0,
      "damper_presence": 1.0,
      "damper_closed_t60_seconds": 0.14,
      "damper_lift_start": 0.082003819884,
      "damper_lift_end": 0.762003819884,
      "sympathetic_open_t60_seconds": 4.551142866424,
      "sympathetic_second_level": 0.46,
      "sympathetic_third_level": 0.28,
      "radiation_scale": 1.0,
      "sympathetic_scale": 1.0
    },
    "30": {
      "tuning_cents": -2.86,
      "inharmonicity_b": 0.000172835275,
      "loss_rate_per_second": 0.094633399,
      "loss_slope_per_second": 0.000460924613,